title,token_count,arxiv_id,category,categories,query_field,published_date,collection_timestamp
Decentralized Intelligence in GameFi: Embodied AI Agents and the Convergence of DeFi and Virtual Ecosystems,331,2412.18601v1,cs.CR,"cs.CR,cs.AI,cs.GT,cs.LG,cs.MA",environmental science,2024-12-24,2024-12-26T11:25:45.417962
Efficient Aircraft Design Optimization Using Multi-Fidelity Models and Multi-fidelity Physics Informed Neural Networks,194,2412.18564v1,cs.LG,"cs.LG,cs.CE",environmental science,2024-12-24,2024-12-26T11:25:45.417962
Fano physics behind the N-resonance in graphene,172,2412.18561v1,cond-mat.mes-hall,"cond-mat.mes-hall,cond-mat.mtrl-sci",environmental science,2024-12-24,2024-12-26T11:25:45.418959
Advancing Surface Chemistry with Large-Scale Ab-Initio Quantum Many-Body Simulations,323,2412.18553v1,cond-mat.mtrl-sci,"cond-mat.mtrl-sci,physics.chem-ph",environmental science,2024-12-24,2024-12-26T11:25:45.419957
A generalized coupling approach for the weak approximation of stochastic functional differential equations,141,2412.18523v1,math.PR,"math.PR,34K50, 65C30, 60F17, 65C20",environmental science,2024-12-24,2024-12-26T11:25:45.419957
Elastic Constants and Bending Rigidities from Long-Wavelength Perturbation Expansions,309,2412.18482v1,cond-mat.mtrl-sci,"cond-mat.mtrl-sci,cond-mat.mes-hall,physics.app-ph,physics.comp-ph",environmental science,2024-12-24,2024-12-26T11:25:45.420954
Linear Enhancement of Spin-Orbit Torques and Absence of Bulk Rashba-Type Spin Splitting in Perpendicularly Magnetized [Pt/Co/W]n Superlattices,356,2412.18481v1,cond-mat.mtrl-sci,cond-mat.mtrl-sci,environmental science,2024-12-24,2024-12-26T11:25:45.421951
Matrix Chaos Inequalities and Chaos of Combinatorial Type,231,2412.18468v1,math.PR,"math.PR,cs.CC,math.FA",environmental science,2024-12-24,2024-12-26T11:25:45.422948
Ultralow-temperature heat transport evidence for residual density of states in the superconducting state of CsV3Sb5,350,2412.18446v1,cond-mat.supr-con,"cond-mat.supr-con,cond-mat.mtrl-sci,cond-mat.str-el",environmental science,2024-12-24,2024-12-26T11:25:45.422948
Normalized field product approach: A parameter-free density evaluation method for close-to-binary solutions in topology optimization with embedded length scale,227,2412.18441v1,cs.CE,cs.CE,environmental science,2024-12-24,2024-12-26T11:25:45.423946
Discovery of 2D Materials via Symmetry-Constrained Diffusion Model,250,2412.18414v1,cond-mat.mtrl-sci,"cond-mat.mtrl-sci,cs.LG,physics.chem-ph",environmental science,2024-12-24,2024-12-26T11:25:45.424943
Depth-resolved Nuclear Resonance Scattering under X-ray standing wave -an approach to study interface magnetism,225,2412.18384v1,cond-mat.mtrl-sci,cond-mat.mtrl-sci,environmental science,2024-12-24,2024-12-26T11:25:45.425941
Learning Generalized Residual Exchange-Correlation-Uncertain Functional for Density Functional Theory,366,2412.18350v1,cs.CE,cs.CE,environmental science,2024-12-24,2024-12-26T11:25:45.426938
Quantum Anharmonic Effects on the Superconductivity of I-43m CH4-H3S at High Pressures: a First-Principles Study,351,2412.18341v1,cond-mat.mtrl-sci,"cond-mat.mtrl-sci,cond-mat.supr-con,physics.app-ph,J.2.9",environmental science,2024-12-24,2024-12-26T11:25:45.426938
"PyAtoms: An interactive tool for rapidly simulating atomic scanning tunneling microscopy images of 2D materials, moiré systems and superlattices",287,2412.18332v1,cond-mat.mes-hall,"cond-mat.mes-hall,cond-mat.mtrl-sci,cond-mat.str-el",environmental science,2024-12-24,2024-12-26T11:25:45.427935
Learning to Play Against Unknown Opponents,253,2412.18297v1,cs.GT,"cs.GT,cs.LG",environmental science,2024-12-24,2024-12-26T11:25:45.428933
Robust Semi-Supervised Learning in Open Environments,194,2412.18256v1,cs.LG,"cs.LG,cs.AI",environmental science,2024-12-24,2024-12-26T11:25:45.429930
Loxodromes and geodesics on rotational surfaces in pseudo-isotropic space,330,2412.18229v1,math.DG,math.DG,environmental science,2024-12-24,2024-12-26T11:25:45.429930
Altermagnetic Spin-Splitting Magnetoresistance,173,2412.18220v1,cond-mat.mes-hall,"cond-mat.mes-hall,cond-mat.mtrl-sci,cond-mat.str-el,cond-mat.supr-con,physics.app-ph",environmental science,2024-12-24,2024-12-26T11:25:45.430927
An AI-directed analytical study on the optical transmission microscopic images of Pseudomonas aeruginosa in planktonic and biofilm states,192,2412.18205v1,physics.med-ph,"physics.med-ph,physics.bio-ph,physics.optics",environmental science,2024-12-24,2024-12-26T11:25:45.431925
"Driving force of atomic ordering in Fe$_{1-x}$Pt$_{x}$, investigated by density functional theory and machine-learning interatomic potentials Monte Carlo simulations",230,2412.18198v1,cond-mat.mtrl-sci,cond-mat.mtrl-sci,environmental science,2024-12-24,2024-12-26T11:25:45.431925
"JANUS: A Stablecoin 3.0 Blueprint for Navigating the Stablecoin Trilemma Through Dual-Token Design, Multi-Collateralization, Soft Peg, and AI-Driven Stabilization",304,2412.18182v1,cs.CE,"cs.CE,91G80,K.4.4",environmental science,2024-12-24,2024-12-26T11:25:45.432922
INVESTORBENCH: A Benchmark for Financial Decision-Making Tasks with LLM-based Agent,248,2412.18174v1,cs.CE,"cs.CE,cs.AI,q-fin.CP",environmental science,2024-12-24,2024-12-26T11:25:45.433919
Entropy-driven electron density and effective model Hamiltonian for boron systems,262,2412.18172v1,cond-mat.mtrl-sci,cond-mat.mtrl-sci,environmental science,2024-12-24,2024-12-26T11:25:45.434917
VISION: A Modular AI Assistant for Natural Human-Instrument Interaction at Scientific User Facilities,224,2412.18161v1,cs.AI,cs.AI,environmental science,2024-12-24,2024-12-26T11:25:45.434917
Statistical mechanics of an active wheel rolling in circles,232,2412.18159v1,cond-mat.soft,"cond-mat.soft,cond-mat.mtrl-sci,cond-mat.stat-mech,physics.app-ph",environmental science,2024-12-24,2024-12-26T11:25:45.435914
scReader: Prompting Large Language Models to Interpret scRNA-seq Data,299,2412.18156v1,q-bio.GN,"q-bio.GN,cs.AI,cs.CL",environmental science,2024-12-24,2024-12-26T11:25:45.436911
An Instrumental Value for Data Production and its Application to Data Pricing,346,2412.18140v1,cs.GT,"cs.GT,cs.LG",environmental science,2024-12-24,2024-12-26T11:25:45.437908
Learning Randomized Reductions and Program Properties,257,2412.18134v1,cs.LG,"cs.LG,cs.CC,cs.PL,cs.SE",environmental science,2024-12-24,2024-12-26T11:25:45.438906
PowerRadio: Manipulate Sensor Measurementvia Power GND Radiation,293,2412.18103v1,eess.SP,"eess.SP,15A06,B.7.3; B.8.1; J.2",environmental science,2024-12-24,2024-12-26T11:25:45.439904
LangYa: Revolutionizing Cross-Spatiotemporal Ocean Forecasting,326,2412.18097v1,physics.ao-ph,"physics.ao-ph,cs.AI",environmental science,2024-12-24,2024-12-26T11:25:45.440900
A Review of 3D Particle Tracking and Flow Diagnostics Using Digital Holography,217,2412.18094v1,physics.flu-dyn,"physics.flu-dyn,physics.app-ph",environmental science,2024-12-24,2024-12-26T11:25:45.440900
Origin of the insulating and superconducting phases in molecular solid $κ$-(BEDT-TTF)$_2$Cu$_2$(CN)$_3$,392,2412.18088v1,cond-mat.str-el,"cond-mat.str-el,cond-mat.mtrl-sci",environmental science,2024-12-24,2024-12-26T11:25:45.441898
Future Pathways for EVTOLs: A Design Optimization Perspective,282,2412.18078v1,eess.SY,"eess.SY,cs.SY",environmental science,2024-12-24,2024-12-26T11:25:45.442895
From Competition to Centralization: The Oligopoly in Ethereum Block Building Auctions,216,2412.18074v1,cs.GT,cs.GT,environmental science,2024-12-24,2024-12-26T11:25:45.443892
Competing electronic ground states in the heavy-fermion superconductor CeRh2As2,248,2412.18068v1,cond-mat.str-el,"cond-mat.str-el,cond-mat.mtrl-sci",environmental science,2024-12-24,2024-12-26T11:25:45.443892
Automated Materials Discovery Platform Realized: Scanning Probe Microscopy of Combinatorial Libraries,227,2412.18067v1,cond-mat.mtrl-sci,"cond-mat.mtrl-sci,cond-mat.mes-hall,cs.AI",environmental science,2024-12-24,2024-12-26T11:25:45.444890
Emergence of topological defects and spin liquid in a two-orbital spin-fermion model on the honeycomb lattice,139,2412.18057v1,cond-mat.str-el,"cond-mat.str-el,cond-mat.dis-nn,cond-mat.mes-hall,cond-mat.mtrl-sci",environmental science,2024-12-24,2024-12-26T11:25:45.445887
Time-Probability Dependent Knowledge Extraction in IoT-enabled Smart Building,267,2412.18042v1,cs.IR,"cs.IR,cs.CE",environmental science,2024-12-23,2024-12-26T11:25:45.445887
An information theoretic limit to data amplification,243,2412.18041v1,stat.ML,"stat.ML,cs.LG,hep-ex,physics.data-an",environmental science,2024-12-23,2024-12-26T11:25:45.446884
Diverse dust populations in the near-Sun environment characterized by PSP/IS$\bigodot$IS,268,2412.18028v1,astro-ph.EP,"astro-ph.EP,astro-ph.SR,physics.space-ph",environmental science,2024-12-23,2024-12-26T11:25:45.447882
Roadmap on Quantum Magnetic Materials,270,2412.18020v1,cond-mat.mtrl-sci,"cond-mat.mtrl-sci,cond-mat.mes-hall",environmental science,2024-12-23,2024-12-26T11:25:45.448879
Fast resets of sub-windows on infrared detectors as a strategy for persistence mitigation,200,2412.18013v1,astro-ph.IM,astro-ph.IM,environmental science,2024-12-23,2024-12-26T11:25:45.449876
Mechanical softening and enhanced elasticity of lunar olivine probed via nanoindentation and high-pressure X-ray diffraction measurements,286,2412.18010v1,astro-ph.EP,"astro-ph.EP,cond-mat.mtrl-sci",environmental science,2024-12-23,2024-12-26T11:25:45.449876
WavePulse: Real-time Content Analytics of Radio Livestreams,236,2412.17998v1,cs.IR,"cs.IR,cs.AI",environmental science,2024-12-23,2024-12-26T11:25:45.450874
Approximating Ground States of Quantum Hamiltonians with Snapshot-QAOA,344,2412.17990v1,quant-ph,quant-ph,environmental science,2024-12-23,2024-12-26T11:25:45.451871
"InAs Nanowire-Based Twin Electrical Sensors enabling Simultaneous Gas Detection Measurements: Nanodevice Engineering, Testing and Signal Fluctuation Analysis",265,2412.17981v1,cond-mat.mes-hall,cond-mat.mes-hall,environmental science,2024-12-23,2024-12-26T11:25:45.452869
A statistical mechanics derivation and implementation of non-conservative phase field models for front propagation in elastic media,267,2412.17972v1,cond-mat.stat-mech,cond-mat.stat-mech,environmental science,2024-12-23,2024-12-26T11:25:45.453866
Dynamic Multi-Agent Orchestration and Retrieval for Multi-Source Question-Answer Systems using Large Language Models,210,2412.17964v1,cs.AI,cs.AI,environmental science,2024-12-23,2024-12-26T11:25:45.453866
Steganography and Probabilistic Risk Analysis: A Game Theoretical Framework for Quantifying Adversary Advantage and Impact,276,2412.17950v1,cs.GT,"cs.GT,cs.CR",environmental science,2024-12-23,2024-12-26T11:25:45.454863
Topological junction states in graphene nanoribbons: A route to topological chemistry,152,2412.17949v1,cond-mat.mes-hall,"cond-mat.mes-hall,cond-mat.mtrl-sci,physics.chem-ph",environmental science,2024-12-23,2024-12-26T11:25:45.455861
Wetting-Layer-Assisted Synthesis of Inverted CdSe/PbSe Quantum Dots and their Photophysical and Photo-Electrical Properties,283,2412.17939v1,cond-mat.mes-hall,"cond-mat.mes-hall,cond-mat.mtrl-sci",environmental science,2024-12-23,2024-12-26T11:25:45.455861
Growth of bulk crystals of magnetic topological insulators under peritectic conditions,252,2412.17915v1,cond-mat.mtrl-sci,"cond-mat.mtrl-sci,cond-mat.other",environmental science,2024-12-23,2024-12-26T11:25:45.456858
"Trading Devil RL: Backdoor attack via Stock market, Bayesian Optimization and Reinforcement Learning",153,2412.17908v1,cs.LG,"cs.LG,cs.CE,physics.comp-ph,physics.soc-ph",environmental science,2024-12-23,2024-12-26T11:25:45.456858
Measurements of the quantum geometric tensor in solids,325,2412.17809v1,cond-mat.mtrl-sci,cond-mat.mtrl-sci,environmental science,2024-12-23,2024-12-26T11:25:45.457855
Observation Interference in Partially Observable Assistance Games,329,2412.17797v1,cs.AI,"cs.AI,cs.GT,cs.LG,cs.MA",environmental science,2024-12-23,2024-12-26T11:25:45.458852
Resolving Discrepancies in Calculations of Mechanical Properties of CH\textsubscript{3}NH\textsubscript{3}PbI\textsubscript{3} Perovskites,272,2412.17771v1,cond-mat.mtrl-sci,cond-mat.mtrl-sci,environmental science,2024-12-23,2024-12-26T11:25:45.459850
A unified and consistent electrical double layer model for treatment of core and space charge layer in solid electrolytes,251,2412.17750v1,cond-mat.mtrl-sci,"cond-mat.mtrl-sci,physics.chem-ph",environmental science,2024-12-23,2024-12-26T11:25:45.459850
Physically Intuitive Anisotropic Model of Hardness,172,2412.17745v1,cond-mat.mtrl-sci,cond-mat.mtrl-sci,environmental science,2024-12-23,2024-12-26T11:25:45.460847
Robin Hood Reachability Bidding Games,203,2412.17718v1,cs.GT,cs.GT,environmental science,2024-12-23,2024-12-26T11:25:45.461844
Ab initio theory of the non-resonant Raman effect in crystals at finite temperature in comparison to experiment: The examples of GaN and BaZrS3,164,2412.17711v1,cond-mat.mtrl-sci,cond-mat.mtrl-sci,environmental science,2024-12-23,2024-12-26T11:25:45.461844
Tailoring the properties of the 2D ferromagnet CrSBr by lanthanide doping,276,2412.17682v1,cond-mat.mtrl-sci,"cond-mat.mtrl-sci,cond-mat.mes-hall",environmental science,2024-12-23,2024-12-26T11:25:45.463839
Euclid: Early Release Observations of diffuse stellar structures and globular clusters as probes of the mass assembly of galaxies in the Dorado group,380,2412.17672v1,astro-ph.GA,"astro-ph.GA,astro-ph.IM",environmental science,2024-12-23,2024-12-26T11:25:45.464836
Effect of arsenic doping on structural and electronic properties of MoSe$_2$ monolayer: an ab initio study,394,2412.17664v1,cond-mat.mtrl-sci,"cond-mat.mtrl-sci,cond-mat.mes-hall",environmental science,2024-12-23,2024-12-26T11:25:45.465834
Dynamic control of ferroic domain patterns by thermal quenching,292,2412.17661v1,cond-mat.mtrl-sci,cond-mat.mtrl-sci,environmental science,2024-12-23,2024-12-26T11:25:45.466831
Discovery of an anomalous non-evaporating sub-nanometre water layer in open environment,203,2412.17636v1,cond-mat.mtrl-sci,"cond-mat.mtrl-sci,cond-mat.mes-hall,quant-ph",environmental science,2024-12-23,2024-12-26T11:25:45.466831
Maximal number of mixed Nash equilibria in generic games where each player has two pure strategies,89,2412.17890v1,math.CO,"math.CO,cs.GT,math.OC,91A06, 91A10, 05A05",environmental science,2024-12-23,2024-12-26T11:25:45.467829
Interplay between dressed and strong-axial-field states in Nitrogen-Vacancy centers for quantum sensing and computation,327,2412.17608v1,quant-ph,quant-ph,environmental science,2024-12-23,2024-12-26T11:25:45.467829
Structured pathways in the turbulence organizing recent oil spill events in the Eastern Mediterranean,277,2412.17597v1,physics.ao-ph,"physics.ao-ph,nlin.CD,physics.flu-dyn",environmental science,2024-12-23,2024-12-26T11:25:45.468826
V$^2$-SfMLearner: Learning Monocular Depth and Ego-motion for Multimodal Wireless Capsule Endoscopy,293,2412.17595v1,cs.CV,"cs.CV,cs.AI,cs.RO",environmental science,2024-12-23,2024-12-26T11:25:45.469823
Simultaneous achievement of record-breaking colossal magnetoresistance and angular magnetoresistance in an antiferromagnetic semiconductor EuSe2,218,2412.17594v1,cond-mat.str-el,"cond-mat.str-el,cond-mat.mtrl-sci",environmental science,2024-12-23,2024-12-26T11:25:45.470821
Evaluation of Bio-Inspired Models under Different Learning Settings For Energy Efficiency in Network Traffic Prediction,332,2412.17565v1,cs.LG,"cs.LG,cs.AI",environmental science,2024-12-23,2024-12-26T11:25:45.470821
Buried Interfaces and Spin Orientation in [Co/Pt]10 /Fe multilayer with Orthogonal Magnetic Anisotropy: Effect of Fe Thickness,415,2412.17555v1,cond-mat.mtrl-sci,cond-mat.mtrl-sci,environmental science,2024-12-23,2024-12-26T11:25:45.471818
Leveraging Cardiovascular Simulations for In-Vivo Prediction of Cardiac Biomarkers,292,2412.17542v1,cs.LG,"cs.LG,cs.CE,physics.bio-ph",environmental science,2024-12-23,2024-12-26T11:25:45.472815
WildPPG: A Real-World PPG Dataset of Long Continuous Recordings,343,2412.17540v1,cs.CV,cs.CV,environmental science,2024-12-23,2024-12-26T11:25:45.473812
A 3-dimensional scanning trapped-ion probe,247,2412.17528v1,quant-ph,"quant-ph,physics.atom-ph",environmental science,2024-12-23,2024-12-26T11:25:45.474810
Disorder-averaged Qudit Dynamics,244,2412.17519v1,quant-ph,quant-ph,environmental science,2024-12-23,2024-12-26T11:25:45.474810
Integrated differential analysis of multi-omics data using a joint mixture model: idiffomix,333,2412.17511v1,stat.ME,stat.ME,environmental science,2024-12-23,2024-12-26T11:25:45.475807
"First-Principles' Derived Force Field for hBN Nanostrucrtures; Applications to Monolayers, Nanotubes and Nanotori",259,2412.17503v1,cond-mat.mes-hall,"cond-mat.mes-hall,cond-mat.mtrl-sci",environmental science,2024-12-23,2024-12-26T11:25:45.476804
Predicting the suitability of photocatalysts for water splitting using Koopmans spectral functionals: The case of TiO$_2$ polymorphs,184,2412.17488v1,cond-mat.mtrl-sci,"cond-mat.mtrl-sci,physics.chem-ph,physics.comp-ph",environmental science,2024-12-23,2024-12-26T11:25:45.477802
Is ChatGPT Massively Used by Students Nowadays? A Survey on the Use of Large Language Models such as ChatGPT in Educational Settings,236,2412.17486v1,cs.CY,"cs.CY,cs.AI",environmental science,2024-12-23,2024-12-26T11:25:45.477802
Power- and Fragmentation-aware Online Scheduling for GPU Datacenters,249,2412.17484v1,cs.DC,"cs.DC,cs.AI",environmental science,2024-12-23,2024-12-26T11:25:45.478799
Interplay of Kitaev Interaction and Off-diagonal Exchanges: Exotic Phases and Quantum Phase Diagrams,224,2412.17476v1,cond-mat.str-el,"cond-mat.str-el,cond-mat.mtrl-sci",environmental science,2024-12-23,2024-12-26T11:25:45.478799
"Bismuth doping induced enhancement of the spin-orbit coupling strength in the prototype dilute ferromagnetic semiconductor (Ga,Mn)As: a review",384,2412.17473v1,cond-mat.mtrl-sci,"cond-mat.mtrl-sci,physics.app-ph",environmental science,2024-12-23,2024-12-26T11:25:45.479796
Collective dynamics behind success,204,2412.17472v1,physics.soc-ph,"physics.soc-ph,cs.SI",environmental science,2024-12-23,2024-12-26T11:25:45.480794
Carbon-based light emitting defects in different layers of hexagonal boron nitride,194,2412.17457v1,cond-mat.mtrl-sci,"cond-mat.mtrl-sci,cond-mat.mes-hall,quant-ph",environmental science,2024-12-23,2024-12-26T11:25:45.481791
A crack-length control technique for phase field fracture in FFT homogenization,288,2412.17445v1,cond-mat.mtrl-sci,"cond-mat.mtrl-sci,cs.NA,math.NA",environmental science,2024-12-23,2024-12-26T11:25:45.481791
How Green Can AI Be? A Study of Trends in Machine Learning Environmental Impacts,290,2412.17376v1,cs.LG,"cs.LG,cs.CY",environmental science,2024-12-23,2024-12-26T11:25:45.482788
Enhanced Superconducting Properties of Bi$_2$Sr$_2$CaCu$_2$O$_{8+δ}$ Films with sub-50-nm Thickness,233,2412.17367v1,cond-mat.supr-con,"cond-mat.supr-con,cond-mat.mtrl-sci,physics.app-ph",environmental science,2024-12-23,2024-12-26T11:25:45.483786
Three-Class Text Sentiment Analysis Based on LSTM,261,2412.17347v1,cs.CL,"cs.CL,cs.CE,cs.LG",environmental science,2024-12-23,2024-12-26T11:25:45.484783
On the Power and Limitations of Examples for Description Logic Concepts,173,2412.17345v1,cs.LO,"cs.LO,cs.LG,F.4.1; I.2.6; I.2.4",environmental science,2024-12-23,2024-12-26T11:25:45.484783
Hierarchical Dirichlet Process Mixture of Products of Multinomial Distributions: Applications to Survey Data with Potentially Missing Values,280,2412.17335v1,stat.ME,stat.ME,environmental science,2024-12-23,2024-12-26T11:25:45.485781
Spatial function-on-function regression,261,2412.17327v1,stat.ME,"stat.ME,stat.CO,62R10",environmental science,2024-12-23,2024-12-26T11:25:45.486778
Feature Based Methods Domain Adaptation for Object Detection: A Review Paper,302,2412.17325v1,cs.CV,"cs.CV,68T07,I.4.8",environmental science,2024-12-23,2024-12-26T11:25:45.486778
Multi-Modal Grounded Planning and Efficient Replanning For Learning Embodied Agents with A Few Examples,231,2412.17288v1,cs.RO,"cs.RO,cs.AI",environmental science,2024-12-23,2024-12-26T11:25:45.487775
Emerging Microelectronic Materials by Design: Navigating Combinatorial Design Space with Scarce and Dispersed Data,314,2412.17283v1,cond-mat.mtrl-sci,"cond-mat.mtrl-sci,cs.CE,cs.LG",environmental science,2024-12-23,2024-12-26T11:25:45.488772
Coupled differential-algebraic equations framework for modeling six-degree-of-freedom flight dynamics of asymmetric fixed-wing aircraft,228,2412.17280v1,eess.SY,"eess.SY,cs.SC,cs.SY,34M15, 65L80, 70E15,I.6.3; I.6.5; J.2",environmental science,2024-12-23,2024-12-26T11:25:45.489770
Neutrinos: Opening new doors,180,2412.17277v1,hep-ph,"hep-ph,hep-th",environmental science,2024-12-23,2024-12-26T11:25:45.489770
"""From Unseen Needs to Classroom Solutions"": Exploring AI Literacy Challenges & Opportunities with Project-based Learning Toolkit in K-12 Education",202,2412.17243v1,cs.AI,"cs.AI,cs.CY,cs.HC",environmental science,2024-12-23,2024-12-26T11:25:45.490767
On the Generalization Ability of Machine-Generated Text Detectors,262,2412.17242v1,cs.AI,"cs.AI,cs.CL",environmental science,2024-12-23,2024-12-26T11:25:48.935076
Crosscap Quenches and Entanglement Evolution,169,2412.18610v1,hep-th,"hep-th,cond-mat.stat-mech,quant-ph",quantum information science,2024-12-24,2024-12-26T11:25:49.748900
PartGen: Part-level 3D Generation and Reconstruction with Multi-View Diffusion Models,297,2412.18608v1,cs.CV,cs.CV,quantum information science,2024-12-24,2024-12-26T11:25:49.749897
Lattice T-duality from non-invertible symmetries in quantum spin chains,251,2412.18606v1,cond-mat.str-el,"cond-mat.str-el,hep-th,quant-ph",quantum information science,2024-12-24,2024-12-26T11:25:49.749897
Probing Entanglement Scaling Across a Quantum Phase Transition on a Quantum Computer,271,2412.18602v1,quant-ph,quant-ph,quantum information science,2024-12-24,2024-12-26T11:25:49.750894
Decentralized Intelligence in GameFi: Embodied AI Agents and the Convergence of DeFi and Virtual Ecosystems,331,2412.18601v1,cs.CR,"cs.CR,cs.AI,cs.GT,cs.LG,cs.MA",quantum information science,2024-12-24,2024-12-26T11:25:49.751892
Double Spending Analysis of Nakamoto Consensus for Time-Varying Mining Rates with Ruin Theory,180,2412.18599v1,cs.CR,"cs.CR,cs.DC,cs.DM,cs.IT,math.IT,math.PR",quantum information science,2024-12-24,2024-12-26T11:25:49.752890
Structure Learning in Gaussian Graphical Models from Glauber Dynamics,255,2412.18594v1,cs.LG,"cs.LG,stat.ML",quantum information science,2024-12-24,2024-12-26T11:25:49.753886
Uniform Additivity of Tripartite Optimized Correlation Measures,213,2412.18586v1,quant-ph,quant-ph,quantum information science,2024-12-24,2024-12-26T11:25:49.753886
Randomized Benchmarking with Synthetic Quantum Circuits,313,2412.18578v1,quant-ph,quant-ph,quantum information science,2024-12-24,2024-12-26T11:25:49.754884
Scalable Quantum-Inspired Optimization through Dynamic Qubit Compression,203,2412.18571v1,quant-ph,"quant-ph,cs.DM,cs.LG",quantum information science,2024-12-24,2024-12-26T11:25:49.755881
Efficient Aircraft Design Optimization Using Multi-Fidelity Models and Multi-fidelity Physics Informed Neural Networks,194,2412.18564v1,cs.LG,"cs.LG,cs.CE",quantum information science,2024-12-24,2024-12-26T11:25:49.755881
Fano physics behind the N-resonance in graphene,172,2412.18561v1,cond-mat.mes-hall,"cond-mat.mes-hall,cond-mat.mtrl-sci",quantum information science,2024-12-24,2024-12-26T11:25:49.756878
A new way to prove configuration reducibility using gauge theory,176,2412.18558v1,math.CO,"math.CO,math.GT,05C10, 05C15, 05C31, 05C70, 57R56, 57M15, 57K16",quantum information science,2024-12-24,2024-12-26T11:25:49.756878
Extendible quantum measurements and limitations on classical communication,272,2412.18556v1,quant-ph,"quant-ph,cs.IT,math.IT",quantum information science,2024-12-24,2024-12-26T11:25:49.757876
Advancing Surface Chemistry with Large-Scale Ab-Initio Quantum Many-Body Simulations,323,2412.18553v1,cond-mat.mtrl-sci,"cond-mat.mtrl-sci,physics.chem-ph",quantum information science,2024-12-24,2024-12-26T11:25:49.758873
Post-pandemic social contacts in Italy: implications for social distancing measures on in-person school and work attendance,355,2412.18549v1,physics.soc-ph,"physics.soc-ph,cs.SI,nlin.AO,physics.med-ph",quantum information science,2024-12-24,2024-12-26T11:25:49.759870
Advancing Deformable Medical Image Registration with Multi-axis Cross-covariance Attention,368,2412.18545v1,eess.IV,"eess.IV,cs.AI,cs.CV",quantum information science,2024-12-24,2024-12-26T11:25:49.760868
PLD-Tree: Persistent Laplacian Decision Tree for Protein-Protein Binding Free Energy Prediction,258,2412.18541v1,q-bio.BM,q-bio.BM,quantum information science,2024-12-24,2024-12-26T11:25:49.760868
Convergence of Statistical Estimators via Mutual Information Bounds,169,2412.18539v1,stat.ML,"stat.ML,cs.LG,math.ST,stat.TH",quantum information science,2024-12-24,2024-12-26T11:25:49.761865
Harnessing Large Language Models for Knowledge Graph Question Answering via Adaptive Multi-Aspect Retrieval-Augmentation,331,2412.18537v1,cs.CL,cs.CL,quantum information science,2024-12-24,2024-12-26T11:25:49.762862
"Flowery Horizons & Bulk Observers: $sl^{(q)}(2,\mathbb{R})$ Drive in $2d$ Holographic CFT",324,2412.18536v1,hep-th,"hep-th,cond-mat.str-el,gr-qc",quantum information science,2024-12-24,2024-12-26T11:25:49.763860
A Time Optimization Framework for the Implementation of Robust and Low-latency Quantum Circuits,266,2412.18533v1,quant-ph,"quant-ph,cs.SY,eess.SY,93-05,D.4.m; F.1.1",quantum information science,2024-12-24,2024-12-26T11:25:49.763860
The exact Wheeler-DeWitt equation for the scale-factor minisuperspace model,260,2412.18532v1,hep-th,"hep-th,gr-qc",quantum information science,2024-12-24,2024-12-26T11:25:49.764857
