title,token_count,arxiv_id,category,categories,query_field,published_date,collection_timestamp
Structural and electronic properties of bulk Li$_{2}$O$_{2}$: first-principles simulations based on numerical atomic orbitals,263,2412.16324v1,cond-mat.mtrl-sci,cond-mat.mtrl-sci,molecular biology,2024-12-20,2024-12-26T11:25:13.277316
Machine-learnt potential highlights melting and freezing of aluminium nanoparticles,279,2412.16294v1,cond-mat.mtrl-sci,"cond-mat.mtrl-sci,cond-mat.mes-hall,physics.comp-ph",molecular biology,2024-12-20,2024-12-26T11:25:13.277316
A Probabilistic Model to Estimate Number Densities from Column Densities in Molecular Clouds,376,2412.16290v1,astro-ph.GA,"astro-ph.GA,astro-ph.IM",molecular biology,2024-12-20,2024-12-26T11:25:13.278314
Practical learning of multi-time statistics in open quantum systems,232,2412.17862v1,quant-ph,quant-ph,molecular biology,2024-12-20,2024-12-26T11:25:13.279311
Local structure and phonon states mediated by intercalation-driven doping in superconducting $Li_{1.0}(C_5H_5N)_yFe_{2-z}Se_2$,474,2412.16103v1,cond-mat.supr-con,"cond-mat.supr-con,cond-mat.mtrl-sci,cond-mat.str-el",molecular biology,2024-12-20,2024-12-26T11:25:13.280308
Cloud-scale elemental abundance variations and the CO-to-dust-mass conversion factor in M31,378,2412.16069v1,astro-ph.GA,astro-ph.GA,molecular biology,2024-12-20,2024-12-26T11:25:13.281305
Time-reversible implementation of MASH for efficient nonadiabatic molecular dynamics,251,2412.15976v1,physics.chem-ph,physics.chem-ph,molecular biology,2024-12-20,2024-12-26T11:25:13.282303
Topological strongly correlated phases in orthorhombic diamond lattice compounds,279,2412.15812v1,cond-mat.str-el,cond-mat.str-el,molecular biology,2024-12-20,2024-12-26T11:25:13.282303
Efficient Hamiltonian Simulation: A Utility Scale Perspective for Covalent Inhibitor Reactivity Prediction,223,2412.15804v1,quant-ph,quant-ph,molecular biology,2024-12-20,2024-12-26T11:25:13.283300
Electromagnetic particle-in-cell modeling of an electron cyclotron resonance plasma discharge in hydrogen,254,2412.15802v1,physics.plasm-ph,physics.plasm-ph,molecular biology,2024-12-20,2024-12-26T11:25:13.284298
Active nitrogen flux measurement during GaN growth based on the transmitted signal detected with a pyrometer,101,2412.15710v1,physics.ins-det,"physics.ins-det,cond-mat.mtrl-sci",molecular biology,2024-12-20,2024-12-26T11:25:13.284298
Room-temperature nonlinear transport and microwave rectification in antiferromagnetic MnBi$_2$Te$_4$ films,210,2412.15591v1,cond-mat.mtrl-sci,cond-mat.mtrl-sci,molecular biology,2024-12-20,2024-12-26T11:25:13.285295
Thin films as practical quantum materials: a status quo and beyond,158,2412.15565v1,cond-mat.mtrl-sci,cond-mat.mtrl-sci,molecular biology,2024-12-20,2024-12-26T11:25:13.285295
Tailoring MBE Growth of c-Mn3Sn Directly on MgO (111): From Islands to Film,243,2412.15442v2,cond-mat.mtrl-sci,"cond-mat.mtrl-sci,physics.app-ph",molecular biology,2024-12-19,2024-12-26T11:25:13.286292
Superconductivity in Epitaxial SiGe for Cryogenic Electronics,293,2412.15421v1,cond-mat.mes-hall,"cond-mat.mes-hall,cond-mat.mtrl-sci",molecular biology,2024-12-19,2024-12-26T11:25:13.287290
Physical principles underpinning molecular-level protein evolution,305,2412.16245v1,q-bio.PE,"q-bio.PE,q-bio.BM",molecular biology,2024-12-19,2024-12-26T11:25:13.287290
Machine learning assisted canonical sampling (MLACS),251,2412.15370v1,cond-mat.mtrl-sci,"cond-mat.mtrl-sci,physics.comp-ph",molecular biology,2024-12-19,2024-12-26T11:25:13.288287
Oscillations of a Water Droplet onto a Horizontally Vibrating Substrate,311,2412.15125v1,physics.flu-dyn,"physics.flu-dyn,cond-mat.soft",molecular biology,2024-12-19,2024-12-26T11:25:13.289284
A Full Transformer-based Framework for Automatic Pain Estimation using Videos,108,2412.15095v1,cs.CV,"cs.CV,cs.AI,cs.LG",molecular biology,2024-12-19,2024-12-26T11:25:13.289284
Learning Disentangled Equivariant Representation for Explicitly Controllable 3D Molecule Generation,208,2412.15086v1,cs.LG,"cs.LG,cs.AI",molecular biology,2024-12-19,2024-12-26T11:25:13.290281
Velocity Jumps for Molecular Dynamics,203,2412.15073v1,physics.comp-ph,"physics.comp-ph,physics.chem-ph",molecular biology,2024-12-19,2024-12-26T11:25:13.290281
Enhancing dynamic range through quantum deamplification,225,2412.15061v1,quant-ph,"quant-ph,cond-mat.quant-gas",molecular biology,2024-12-19,2024-12-26T11:25:13.291279
Non-Markovian Effects in Quantum Rate Calculations of Hydrogen Diffusion with Electronic Friction,192,2412.15014v1,cond-mat.mtrl-sci,"cond-mat.mtrl-sci,physics.chem-ph",molecular biology,2024-12-19,2024-12-26T11:25:13.292276
Observation of liquid-solid transition of nanoconfined water at ambient temperature,350,2412.15001v1,cond-mat.mes-hall,cond-mat.mes-hall,molecular biology,2024-12-19,2024-12-26T11:25:13.292276
The liquid-liquid phase transition of hydrogen and its critical point: Analysis from ab initio simulation and a machine-learned potential,194,2412.14953v1,cond-mat.stat-mech,cond-mat.stat-mech,molecular biology,2024-12-19,2024-12-26T11:25:13.293273
Diffusion priors for Bayesian 3D reconstruction from incomplete measurements,244,2412.14897v1,cs.LG,cs.LG,molecular biology,2024-12-19,2024-12-26T11:25:13.294271
Individual assembly of two-species Rydberg molecules using optical tweezers,195,2412.14888v1,physics.atom-ph,"physics.atom-ph,quant-ph",molecular biology,2024-12-19,2024-12-26T11:25:13.294271
Rydberg states and new resonant states of the imidogen molecule NH: pathways for nitrogen release,288,2412.14830v1,physics.atom-ph,"physics.atom-ph,physics.plasm-ph,quant-ph",molecular biology,2024-12-19,2024-12-26T11:25:13.295268
Polarized Dust Emission in Arp220: Magnetic Fields in the Core of an Ultraluminous Infrared Galaxy,279,2412.14770v1,astro-ph.GA,astro-ph.GA,molecular biology,2024-12-19,2024-12-26T11:25:13.296266
Milestones at the Origin of Life,249,2412.14754v1,q-bio.PE,"q-bio.PE,astro-ph.EP",molecular biology,2024-12-19,2024-12-26T11:25:13.296266
Towards a mathematical framework for modelling cell fate dynamics,347,2412.14726v1,q-bio.SC,"q-bio.SC,cond-mat.stat-mech,math.DS,q-bio.CB",molecular biology,2024-12-19,2024-12-26T11:25:13.297264
Computing Gram Matrix for SMILES Strings using RDKFingerprint and Sinkhorn-Knopp Algorithm,319,2412.14717v1,cs.LG,cs.LG,molecular biology,2024-12-19,2024-12-26T11:25:13.298260
The JWST/NIRSpec view of the nuclear region in the prototypical merging galaxy NGC 6240,468,2412.14685v1,astro-ph.GA,astro-ph.GA,molecular biology,2024-12-19,2024-12-26T11:25:13.299258
Trainable Adaptive Activation Function Structure (TAAFS) Enhances Neural Network Force Field Performance with Only Dozens of Additional Parameters,178,2412.14655v1,cs.LG,cs.LG,molecular biology,2024-12-19,2024-12-26T11:25:13.300255
Dual Photonics Probing of Nano- to Submicron-Scale Structural Alterations in Human Brain Tissues or Cells and Chromatin or DNA with the Progression of Alzheimers Disease,279,2412.14651v1,physics.med-ph,"physics.med-ph,physics.bio-ph,physics.optics",molecular biology,2024-12-19,2024-12-26T11:25:13.301252
Quantum expectation value estimation by doubling the number of qubits,242,2412.14466v1,quant-ph,quant-ph,molecular biology,2024-12-19,2024-12-26T11:25:13.301252
Time-Reversal Symmetry-Protected Coherent Control of Ultracold Molecular Collisions,319,2412.14425v1,physics.atom-ph,"physics.atom-ph,physics.chem-ph,quant-ph",molecular biology,2024-12-19,2024-12-26T11:25:13.302250
Gaussian-convolution-invariant shell approximation to spherically-symmetric functions,303,2412.14350v1,math.NA,"math.NA,cs.CE,cs.NA,math-ph,math.MP,q-bio.BM",molecular biology,2024-12-18,2024-12-26T11:25:13.303247
Revisiting the Nowosiółka skull with RMaCzek,91,2412.14343v1,stat.AP,"stat.AP,q-bio.PE,62H99, 62-04, 92B10",molecular biology,2024-12-18,2024-12-26T11:25:13.303247
GREGoR: Accelerating Genomics for Rare Diseases,269,2412.14338v1,q-bio.OT,q-bio.OT,molecular biology,2024-12-18,2024-12-26T11:25:13.304244
Henry constant of helium in liquid lead-lithium alloys,235,2412.14152v1,cond-mat.mtrl-sci,cond-mat.mtrl-sci,molecular biology,2024-12-18,2024-12-26T11:25:13.305242
Re-visiting the intracellular pathway of transferrin on board of a mathematical simulation,247,2412.14131v1,q-bio.SC,q-bio.SC,molecular biology,2024-12-18,2024-12-26T11:25:13.305242
Machine Learning Co-pilot for Screening of Organic Molecular Additives for Perovskite Solar Cells,320,2412.14109v1,cs.LG,"cs.LG,cond-mat.mtrl-sci,physics.app-ph",molecular biology,2024-12-18,2024-12-26T11:25:13.306239
Dynamical Screening of Local Spin Moments at Metal-Molecule Interfaces,228,2412.14078v1,cond-mat.str-el,"cond-mat.str-el,cond-mat.mtrl-sci,physics.chem-ph,quant-ph",molecular biology,2024-12-18,2024-12-26T11:25:13.307237
Polymer/paper-based double touch mode capacitive pressure sensing element for wireless control of robotic arm,207,2412.17845v1,eess.SP,"eess.SP,cs.RO",molecular biology,2024-12-18,2024-12-26T11:25:13.307237
Using Partial Structure R1 to Do Molecular Replacement Calculations,322,2412.14034v1,physics.data-an,physics.data-an,molecular biology,2024-12-18,2024-12-26T11:25:13.308234
Machine learning in wastewater treatment: insights from modelling a pilot denitrification reactor,334,2412.14030v1,cs.LG,cs.LG,molecular biology,2024-12-18,2024-12-26T11:25:13.309231
Cold source of atomic hydrogen for loading large magnetic traps,359,2412.13981v2,physics.atom-ph,physics.atom-ph,molecular biology,2024-12-18,2024-12-26T11:25:13.310228
Ion Sieving in Two-Dimensional Membranes from First Principles,198,2412.13899v1,cond-mat.soft,"cond-mat.soft,cond-mat.mtrl-sci",molecular biology,2024-12-18,2024-12-26T11:25:13.310228
Fool's gold: ligand-receptor interactions and the origins of life,315,2412.13836v1,physics.bio-ph,"physics.bio-ph,quant-ph",molecular biology,2024-12-18,2024-12-26T11:25:13.311226
Hunting pre-stellar cores with APEX: IRAS16293E (Oph464),497,2412.13760v1,astro-ph.GA,astro-ph.GA,molecular biology,2024-12-18,2024-12-26T11:25:13.312223
"Segregation, ordering, and precipitation in refractory alloys",233,2412.13750v1,cond-mat.mtrl-sci,cond-mat.mtrl-sci,molecular biology,2024-12-18,2024-12-26T11:25:13.313221
Data-driven Discovery of Biophysical T Cell Receptor Co-specificity Rules,229,2412.13722v1,q-bio.BM,"q-bio.BM,cs.LG,physics.bio-ph",molecular biology,2024-12-18,2024-12-26T11:25:13.314218
Cross-Attention Graph Neural Networks for Inferring Gene Regulatory Networks with Skewed Degree Distribution,242,2412.16220v2,q-bio.QM,"q-bio.QM,cs.AI,cs.LG",molecular biology,2024-12-18,2024-12-26T11:25:16.842293
Pretraining with random noise for uncertainty calibration,227,2412.17411v1,cs.LG,"cs.LG,cs.AI,cs.NE",neuroscience,2024-12-23,2024-12-26T11:25:17.617221
Three mechanistically different variability and noise sources in the trial-to-trial fluctuations of responses to brain stimulation,315,2412.16997v1,q-bio.NC,"q-bio.NC,eess.SP,q-bio.QM,stat.AP",neuroscience,2024-12-22,2024-12-26T11:25:17.618218
Fast Multi-Group Gaussian Process Factor Models,276,2412.16773v1,stat.ML,"stat.ML,cs.LG,eess.SP,q-bio.NC",neuroscience,2024-12-21,2024-12-26T11:25:17.619215
Towards Safe and Honest AI Agents with Neural Self-Other Overlap,276,2412.16325v1,cs.AI,"cs.AI,cs.CR",neuroscience,2024-12-20,2024-12-26T11:25:17.619215
Statistical mechanics of directed networks,188,2412.15923v1,cond-mat.dis-nn,cond-mat.dis-nn,neuroscience,2024-12-20,2024-12-26T11:25:17.620213
Does the brain behave like a (complex) network? I. Dynamics,213,2412.15711v2,q-bio.NC,"q-bio.NC,cond-mat.dis-nn,nlin.AO",neuroscience,2024-12-20,2024-12-26T11:25:17.621211
Associative memory inspires improvements for in-context learning using a novel attention residual stream architecture,218,2412.15113v1,cs.NE,"cs.NE,cs.AI,cs.CL,92B20, 68T01, 68T37, 68T50,I.2; I.5; I.7; J.2; J.3",neuroscience,2024-12-19,2024-12-26T11:25:17.622207
Deep reinforcement learning with time-scale invariant memory,181,2412.15292v1,cs.AI,"cs.AI,cs.LG",neuroscience,2024-12-19,2024-12-26T11:25:17.623204
Multi-Modal Latent Variables for Cross-Individual Primary Visual Cortex Modeling and Analysis,288,2412.14536v1,q-bio.NC,q-bio.NC,neuroscience,2024-12-19,2024-12-26T11:25:17.624202
CwA-T: A Channelwise AutoEncoder with Transformer for EEG Abnormality Detection,280,2412.14522v2,cs.LG,"cs.LG,cs.AI,cs.NE,eess.SP,I.2",neuroscience,2024-12-19,2024-12-26T11:25:17.624202
Diverging network architecture of the $\textit{C. elegans}$ connectome and signaling network,320,2412.14498v1,q-bio.NC,q-bio.NC,neuroscience,2024-12-19,2024-12-26T11:25:17.625199
Starting a Synthetic Biological Intelligence Lab from Scratch,250,2412.14112v1,q-bio.NC,q-bio.NC,neuroscience,2024-12-18,2024-12-26T11:25:17.626197
Functional connectomes of neural networks,169,2412.15279v1,cs.NE,"cs.NE,cs.AI,cs.LG,q-bio.NC",neuroscience,2024-12-18,2024-12-26T11:25:17.626197
Shared Attention-based Autoencoder with Hierarchical Fusion-based Graph Convolution Network for sEEG SOZ Identification,392,2412.12651v1,cs.LG,"cs.LG,cs.AI,eess.SP,q-bio.NC",neuroscience,2024-12-17,2024-12-26T11:25:17.627194
Modality-Driven Design for Multi-Step Dexterous Manipulation: Insights from Neuroscience,217,2412.11337v1,cs.RO,"cs.RO,cs.AI,cs.CV",neuroscience,2024-12-15,2024-12-26T11:25:17.628191
EEG-GMACN: Interpretable EEG Graph Mutual Attention Convolutional Network,210,2412.17834v1,eess.SP,"eess.SP,cs.LG",neuroscience,2024-12-15,2024-12-26T11:25:17.629188
Distribution free uncertainty quantification in neuroscience-inspired deep operators,308,2412.09369v1,stat.ML,"stat.ML,cs.LG",neuroscience,2024-12-12,2024-12-26T11:25:17.629188
A Spectral Framework for Tracking Communities in Evolving Networks,215,2412.07378v1,cs.SI,"cs.SI,cs.LG,stat.ML",neuroscience,2024-12-10,2024-12-26T11:25:17.630186
QuantFormer: Learning to Quantize for Neural Activity Forecasting in Mouse Visual Cortex,334,2412.07264v1,q-bio.NC,"q-bio.NC,cs.CV,eess.IV,eess.SP",neuroscience,2024-12-10,2024-12-26T11:25:17.631183
Exploring Coding Spot: Understanding Parametric Contributions to LLM Coding Performance,161,2412.07113v1,cs.CL,cs.CL,neuroscience,2024-12-10,2024-12-26T11:25:17.632180
Primary visual cortex contributes to color constancy by predicting rather than discounting the illuminant: evidence from a computational study,307,2412.07102v1,q-bio.NC,"q-bio.NC,cs.CV",neuroscience,2024-12-10,2024-12-26T11:25:17.632180
Convolution goes higher-order: a biologically inspired mechanism empowers image classification,287,2412.06740v1,cs.CV,"cs.CV,cs.LG,q-bio.NC",neuroscience,2024-12-09,2024-12-26T11:25:17.633178
Diff5T: Benchmarking Human Brain Diffusion MRI with an Extensive 5.0 Tesla K-Space and Spatial Dataset,228,2412.06666v1,eess.IV,"eess.IV,cs.CV,physics.med-ph",neuroscience,2024-12-09,2024-12-26T11:25:17.634175
Flexible and Scalable Deep Dendritic Spiking Neural Networks with Multiple Nonlinear Branching,399,2412.06355v1,cs.NE,cs.NE,neuroscience,2024-12-09,2024-12-26T11:25:17.635172
Statistical Mechanics of Support Vector Regression,196,2412.05439v1,cond-mat.dis-nn,"cond-mat.dis-nn,q-bio.NC,stat.ML",neuroscience,2024-12-06,2024-12-26T11:25:17.635172
Learning Networks from Wide-Sense Stationary Stochastic Processes,406,2412.03768v1,stat.ML,"stat.ML,cs.LG,eess.SP",neuroscience,2024-12-04,2024-12-26T11:25:17.636170
Artificial Intelligence without Restriction Surpassing Human Intelligence with Probability One: Theoretical Insight into Secrets of the Brain with AI Twins of the Brain,321,2412.06820v1,cs.AI,cs.AI,neuroscience,2024-12-04,2024-12-26T11:25:17.637168
Demonstrating the Advantages of Analog Wafer-Scale Neuromorphic Hardware,233,2412.02619v1,cs.NE,cs.NE,neuroscience,2024-12-03,2024-12-26T11:25:17.638164
Multi-timescale synaptic plasticity on analog neuromorphic hardware,246,2412.02515v1,q-bio.QM,"q-bio.QM,q-bio.NC",neuroscience,2024-12-03,2024-12-26T11:25:17.639162
The Landscape of Causal Discovery Data: Grounding Causal Discovery in Real-World Applications,159,2412.01953v1,cs.LG,"cs.LG,stat.ME",neuroscience,2024-12-02,2024-12-26T11:25:17.639162
Handwriting-based Automated Assessment and Grading of Degree of Handedness: A Pilot Study,311,2412.01587v1,cs.AI,"cs.AI,cs.HC",neuroscience,2024-12-02,2024-12-26T11:25:17.640159
Federated Block-Term Tensor Regression for decentralised data analysis in healthcare,375,2412.06815v1,cs.LG,cs.LG,neuroscience,2024-12-02,2024-12-26T11:25:17.641156
Shadow of the (Hierarchical) Tree: Reconciling Symbolic and Predictive Components of the Neural Code for Syntax,258,2412.01276v1,cs.CL,cs.CL,neuroscience,2024-12-02,2024-12-26T11:25:17.641156
Simplified derivations for high-dimensional convex learning problems,168,2412.01110v3,cond-mat.dis-nn,"cond-mat.dis-nn,cs.NE,q-bio.NC",neuroscience,2024-12-02,2024-12-26T11:25:17.642154
Generative Modeling of Neural Dynamics via Latent Stochastic Differential Equations,218,2412.12112v1,q-bio.NC,"q-bio.NC,cs.LG",neuroscience,2024-12-01,2024-12-26T11:25:17.643151
Why does time feel the way it does? Towards a principled account of temporal experience,372,2412.13198v1,q-bio.NC,q-bio.NC,neuroscience,2024-11-30,2024-12-26T11:25:17.643151
Spatial Clustering of Molecular Localizations with Graph Neural Networks,212,2412.00173v1,cs.LG,"cs.LG,physics.bio-ph,physics.data-an,q-bio.QM",neuroscience,2024-11-29,2024-12-26T11:25:17.644148
A potassium ion channel simulated with a universal neural network potential,231,2411.18931v1,q-bio.BM,"q-bio.BM,cond-mat.soft",neuroscience,2024-11-28,2024-12-26T11:25:17.645146
NeuroAI for AI Safety,220,2411.18526v1,cs.AI,"cs.AI,cs.LG",neuroscience,2024-11-27,2024-12-26T11:25:17.645146
Storing overlapping associative memories on latent manifolds in low-rank spiking networks,261,2411.17485v1,q-bio.NC,"q-bio.NC,cs.LG,cs.NE",neuroscience,2024-11-26,2024-12-26T11:25:17.646143
"Energy Consumption Optimization, Response Time Differences and Indicators in Cortical Working Memory Revealed by Nonequilibrium",305,2411.17206v1,q-bio.NC,q-bio.NC,neuroscience,2024-11-26,2024-12-26T11:25:17.647140
Energy landscape analysis based on the Ising model: Tutorial review,154,2411.16979v1,cond-mat.dis-nn,cond-mat.dis-nn,neuroscience,2024-11-25,2024-12-26T11:25:17.647140
Stability of Brain Functional Network During Working Memory Using Structural Balance Theory,279,2411.16558v1,q-bio.NC,q-bio.NC,neuroscience,2024-11-25,2024-12-26T11:25:17.648138
The brain versus AI: World-model-based versatile circuit computation underlying diverse functions in the neocortex and cerebellum,336,2411.16075v2,q-bio.NC,"q-bio.NC,cs.AI",neuroscience,2024-11-25,2024-12-26T11:25:17.649135
Minimizing information loss reduces spiking neuronal networks to differential equations,293,2411.14801v1,q-bio.NC,"q-bio.NC,math.DS",neuroscience,2024-11-22,2024-12-26T11:25:17.650132
Mode-conditioned music learning and composition: a spiking neural network inspired by neuroscience and psychology,308,2411.14773v1,cs.SD,"cs.SD,cs.AI,eess.AS,q-bio.NC",neuroscience,2024-11-22,2024-12-26T11:25:17.651130
Evaluating Representational Similarity Measures from the Lens of Functional Correspondence,286,2411.14633v1,q-bio.NC,"q-bio.NC,cs.AI,cs.CV",neuroscience,2024-11-21,2024-12-26T11:25:17.652128
CODE-CL: COnceptor-Based Gradient Projection for DEep Continual Learning,282,2411.15235v1,cs.LG,"cs.LG,cs.AI,cs.CV,cs.NE",neuroscience,2024-11-21,2024-12-26T11:25:17.652128
Roadmap on Advances in Visual and Physiological Optics,294,2411.14606v1,physics.optics,physics.optics,neuroscience,2024-11-21,2024-12-26T11:25:17.653124
Adaptive Intelligence: leveraging insights from adaptive behavior in animals to build flexible AI systems,135,2411.15234v2,q-bio.NC,"q-bio.NC,cs.AI",neuroscience,2024-11-21,2024-12-26T11:25:17.654122
OpenScholar: Synthesizing Scientific Literature with Retrieval-augmented LMs,324,2411.14199v1,cs.CL,"cs.CL,cs.AI,cs.DL,cs.IR,cs.LG",neuroscience,2024-11-21,2024-12-26T11:25:17.654122
Spiking neural networks: Towards bio-inspired multimodal perception in robotics,155,2411.14147v1,eess.IV,eess.IV,neuroscience,2024-11-21,2024-12-26T11:25:17.655119
EEG Signal Denoising Using pix2pix GAN: Enhancing Neurological Data Analysis,202,2411.13288v1,eess.SP,"eess.SP,I.4.9",neuroscience,2024-11-20,2024-12-26T11:25:17.655119
Neuro-3D: Towards 3D Visual Decoding from EEG Signals,270,2411.12248v2,cs.CV,cs.CV,neuroscience,2024-11-19,2024-12-26T11:25:17.656116
Unbiased Approximations for Stationary Distributions of McKean-Vlasov SDEs,232,2411.11270v1,stat.ME,"stat.ME,cs.NA,math.NA,math.PR,stat.CO",neuroscience,2024-11-18,2024-12-26T11:25:17.657114
Beyond Human-Like Processing: Large Language Models Perform Equivalently on Forward and Backward Scientific Text,182,2411.11061v1,cs.CL,"cs.CL,q-bio.NC",neuroscience,2024-11-17,2024-12-26T11:25:17.657114
Demonstrating Remote Synchronization: An Experimental Approach with Nonlinear Oscillators,173,2411.10769v1,eess.SY,"eess.SY,cs.SY,nlin.CD",neuroscience,2024-11-16,2024-12-26T11:25:17.658111
Adapting the Biological SSVEP Response to Artificial Neural Networks,213,2411.10084v1,cs.AI,cs.AI,neuroscience,2024-11-15,2024-12-26T11:25:17.659108
FedRewind: Rewinding Continual Model Exchange for Decentralized Federated Learning,217,2411.09842v1,cs.LG,cs.LG,neuroscience,2024-11-14,2024-12-26T11:25:17.659108
The Hydrodynamic Limit of Hawkes Processes on Adaptive Stochastic Networks,193,2411.09260v1,math.PR,math.PR,neuroscience,2024-11-14,2024-12-26T11:25:17.660106
VidMan: Exploiting Implicit Dynamics from Video Diffusion Model for Effective Robot Manipulation,308,2411.09153v1,cs.CV,"cs.CV,cs.RO",neuroscience,2024-11-14,2024-12-26T11:25:17.661103
Bayesian Comparisons Between Representations,261,2411.08739v1,cs.LG,"cs.LG,q-bio.QM",neuroscience,2024-11-13,2024-12-26T11:25:17.661103
Learning Dynamic Cognitive Map with Autonomous Navigation,215,2411.08447v1,cs.RO,"cs.RO,cs.AI",neuroscience,2024-11-13,2024-12-26T11:25:17.662100
Firing Rate Models as Associative Memory: Excitatory-Inhibitory Balance for Robust Retrieval,222,2411.07388v1,q-bio.NC,"q-bio.NC,cond-mat.dis-nn,cond-mat.stat-mech,cs.AI,math.DS,37N25 (Primary) 34D45, 34D23 (Secondary),I.2.11; I.5.1",neuroscience,2024-11-11,2024-12-26T11:25:17.662100
Factorised Active Inference for Strategic Multi-Agent Interactions,318,2411.07362v1,cs.MA,"cs.MA,cs.GT,cs.LG",neuroscience,2024-11-11,2024-12-26T11:25:17.663098
Identifying the impact of local connectivity patterns on dynamics in excitatory-inhibitory networks,347,2411.06802v2,q-bio.NC,"q-bio.NC,cond-mat.dis-nn,cs.NE",neuroscience,2024-11-11,2024-12-26T11:25:17.664095
Expansion microscopy reveals neural circuit organization in genetic animal models,122,2411.06676v1,q-bio.NC,q-bio.NC,neuroscience,2024-11-11,2024-12-26T11:25:17.665093
Evaluating tDCS Intervention Effectiveness via Functional Connectivity Network on Resting-State EEG Data in Major Depressive Disorder,292,2411.06359v1,q-bio.QM,"q-bio.QM,q-bio.NC",neuroscience,2024-11-10,2024-12-26T11:25:17.665093
Deep Nonparametric Conditional Independence Tests for Images,331,2411.06140v1,stat.ML,"stat.ML,cs.LG,eess.IV,math.ST,stat.ME,stat.TH",neuroscience,2024-11-09,2024-12-26T11:25:17.666090
Discovering Latent Structural Causal Models from Spatio-Temporal Data,257,2411.05331v1,cs.LG,"cs.LG,stat.ML",neuroscience,2024-11-08,2024-12-26T11:25:17.667087
The Semantic Hub Hypothesis: Language Models Share Semantic Representations Across Languages and Modalities,264,2411.04986v2,cs.CL,cs.CL,neuroscience,2024-11-07,2024-12-26T11:25:17.668085
Optimal control under unknown intensity with Bayesian learning,110,2411.04917v1,math.OC,"math.OC,math.PR,62M20, 49L20, 49L25",neuroscience,2024-11-07,2024-12-26T11:25:17.668085
NeuroFly: A framework for whole-brain single neuron reconstruction,351,2411.04715v1,cs.CV,"cs.CV,q-bio.QM",neuroscience,2024-11-07,2024-12-26T11:25:17.669082
Flexible task abstractions emerge in linear networks with fast and bounded units,333,2411.03840v1,cs.LG,"cs.LG,q-bio.NC",neuroscience,2024-11-06,2024-12-26T11:25:17.670079
"Beyond networks, towards adaptive systems",243,2411.03621v1,q-bio.OT,q-bio.OT,neuroscience,2024-11-06,2024-12-26T11:25:17.671076
A scalable generative model for dynamical system reconstruction from neuroimaging data,333,2411.02949v1,cs.LG,"cs.LG,math.DS,nlin.CD,physics.data-an",neuroscience,2024-11-05,2024-12-26T11:25:17.671076
Learning to Assist Humans without Inferring Rewards,251,2411.02623v2,cs.AI,"cs.AI,cs.CY,cs.HC,cs.LG",neuroscience,2024-11-04,2024-12-26T11:25:17.672074
Distributionally Robust Optimization,156,2411.02549v1,math.OC,"math.OC,cs.LG,stat.ML",neuroscience,2024-11-04,2024-12-26T11:25:17.673071
The LLM Language Network: A Neuroscientific Approach for Identifying Causally Task-Relevant Units,219,2411.02280v1,cs.CL,"cs.CL,cs.LG",neuroscience,2024-11-04,2024-12-26T11:25:17.673071
Are EEG functional networks really describing the brain? A comparison with other information-processing complex systems,209,2411.01522v1,q-bio.NC,"q-bio.NC,physics.data-an",neuroscience,2024-11-03,2024-12-26T11:25:17.674068
Object segmentation from common fate: Motion energy processing enables human-like zero-shot generalization to random dot stimuli,324,2411.01505v1,cs.CV,cs.CV,neuroscience,2024-11-03,2024-12-26T11:25:17.675066
Nonparametric estimation of Hawkes processes with RKHSs,256,2411.00621v1,stat.ML,"stat.ML,cs.LG,stat.ME",neuroscience,2024-11-01,2024-12-26T11:25:17.675066
Strongly Topology-preserving GNNs for Brain Graph Super-resolution,362,2411.02525v1,cs.LG,"cs.LG,cs.AI",neuroscience,2024-11-01,2024-12-26T11:25:17.676063
Understanding the Limits of Vision Language Models Through the Lens of the Binding Problem,232,2411.00238v1,cs.AI,"cs.AI,cs.CV,cs.LG,q-bio.NC",neuroscience,2024-10-31,2024-12-26T11:25:17.677060
Enhancing Brain Source Reconstruction through Physics-Informed 3D Neural Networks,301,2411.00143v1,eess.IV,"eess.IV,cs.LG",neuroscience,2024-10-31,2024-12-26T11:25:17.678058
